Date,Channel,Keyword,Message Text,Link
"2025-12-11 04:01:24","PHLNews","shell","Shell sued in UK over 2021 Philippine Typhoon Odette -- NGOs  https://www.gmanetwork.com/news/topstories/nation/969181/shell-sued-in-uk-over-2021-philippine-typhoon-odette-ngos/story/","https://t.me/PHLNews/199582"
"2025-10-30 00:39:54","PHLNews","shell","Filipino Odette survivors sue Shell over typhoon losses  https://www.philstar.com/climate-and-environment/2025/10/30/2483612/filipino-odette-survivors-sue-shell-over-typhoon-losses","https://t.me/PHLNews/198104"
"2025-07-25 07:35:15","PHLNews","shell","The Royal Thai Army deployed its M758 Autonomous Howitzer early Thursday, firing multiple 155mm shells at Cambodian military positions near the Preah Vihear temple. The strikes mark a sharp escalation following Cambodia’s RM-70 rocket barrage that killed at least 14 civilians in Thai border towns. Thailand’s Defense Ministry said the precision artillery strike targeted command posts and artillery depots used in recent attacks. No official casualty figures have been released by Phnom Penh, but regional observers warn the exchange risks triggering a broader conflict if diplomacy fails.","https://t.me/PHLNews/194719"
"2025-04-17 07:38:03","PHLNews","shell","Tax court grants oil firm’s P85-M refund  https://newsinfo.inquirer.net/2053435/tax-court-grants-oil-firms-p85-m-refund","https://t.me/PHLNews/191485"
"2025-04-11 22:50:54","PHLNews","shell","Meralco readies hefty power rate increase for April consumption  https://newsinfo.inquirer.net/2052145/meralco-readies-hefty-power-rate-increase-for-april-consumption","https://t.me/PHLNews/191315"
"2025-02-01 07:05:44","PHLNews","shell","LPG prices up this February  https://www.philstar.com/business/2025/02/01/2418447/lpg-prices-february","https://t.me/PHLNews/188957"
"2024-11-14 08:56:50","PHLNews","shell","'New chapter': First Philippine eagle chick hatches at new Davao sanctuary  https://www.philstar.com/headlines/2024/11/14/2400101/new-chapter-first-philippine-eagle-chick-hatches-new-davao-sanctuary","https://t.me/PHLNews/186555"
"2024-10-14 23:40:34","PHLNews","shell","Hefty oil price hikes take effect on Oct. 15  https://newsinfo.inquirer.net/1992622/hefty-oil-price-hikes-take-effect-on-oct-15","https://t.me/PHLNews/185515"
"2024-07-08 22:27:53","PHLNews","shell","Oil firms hike prices anew  https://newsinfo.inquirer.net/1959167/oil-firms-hike-prices-anew","https://t.me/PHLNews/182041"
"2023-10-02 21:44:12","PHLNews","shell","Gasoline prices drop, but diesel up  https://newsinfo.inquirer.net/1839976/gasoline-prices-drop-but-diesel-up","https://t.me/PHLNews/171685"
"2023-07-26 06:26:49","PHLNews","shell","House reso to probe ‘indiscriminate’ aerial bombings filed  https://www.philstar.com/headlines/2023/07/26/2283962/house-reso-probe-indiscriminate-aerial-bombings-filed","https://t.me/PHLNews/169092"
"2023-07-25 08:29:09","PHLNews","shell","Oil companies raise fuel prices anew  https://newsinfo.inquirer.net/1806751/oil-companies-raise-fuel-prices-anew-3","https://t.me/PHLNews/169052"
"2023-06-26 12:34:07","PHLNews","shell","Estrada sees passage of MUP pension reform by year's end  https://www.gmanetwork.com/news/topstories/nation/874023/estrada-sees-passage-of-mup-pension-reform-by-year-s-end/story/","https://t.me/PHLNews/167928"
"2023-06-19 11:14:23","PHLNews","shell","DENR asked to scrap MOU with oil firm  https://newsinfo.inquirer.net/1789944/denr-asked-to-scrap-mou-with-oil-firm","https://t.me/PHLNews/167681"
"2023-06-05 23:55:14","PHLNews","shell","Local oil companies roll back fuel prices  https://newsinfo.inquirer.net/1779928/local-oil-companies-roll-back-fuel-prices","https://t.me/PHLNews/167198"
"2023-04-23 02:33:11","PHLNews","shell","Immigration warns vs love scams that also use fake letters from the bureau  https://www.philstar.com/headlines/2023/04/23/2261024/immigration-warns-vs-love-scams-also-use-fake-letters-bureau","https://t.me/PHLNews/165452"
"2023-04-21 10:23:57","PHLNews","shell","De Lima says she'll gain freedom based on merits of her case, not for humanitarian reasons  https://www.philstar.com/headlines/2023/04/21/2260634/de-lima-says-shell-gain-freedom-based-merits-her-case-not-humanitarian-reasons","https://t.me/PHLNews/165391"
"2023-02-22 19:07:56","PHLNews","shell","Startup with 1st plantable bamboo toothbrush wins Shell LiveWIRE grand prize  https://mb.com.ph/2023/02/22/startup-with-1st-plantable-bamboo-toothbrush-wins-shell-livewire-grand-prize/?utm_source=rss&utm_medium=rss&utm_campaign=startup-with-1st-plantable-bamboo-toothbrush-wins-shell-livewire-grand-prize","https://t.me/PHLNews/163723"
"2023-02-11 04:59:14","PHLNews","shell","New Shell V-Power formula cleans and restores power  https://mb.com.ph/2023/02/11/new-shell-v-power-formula-cleans-and-restores-power/?utm_source=rss&utm_medium=rss&utm_campaign=new-shell-v-power-formula-cleans-and-restores-power","https://t.me/PHLNews/162388"
"2023-02-02 10:17:41","PHLNews","shell","2023 BCYF Innovation Award nominations open until mid-Feb, P1-M cash prize up for grabs – DOST  https://mb.com.ph/2023/02/02/2023-bcyf-innovation-award-nominations-open-until-mid-feb-p1-m-cash-prize-up-for-grabs-dost/?utm_source=rss&utm_medium=rss&utm_campaign=2023-bcyf-innovation-award-nominations-open-until-mid-feb-p1-m-cash-prize-up-for-grabs-dost","https://t.me/PHLNews/161424"
"2023-01-22 12:41:30","PHLNews","shell","Shell to help DOE on EV charger standards  https://mb.com.ph/2023/01/22/shell-to-help-doe-on-ev-charger-standards/?utm_source=rss&utm_medium=rss&utm_campaign=shell-to-help-doe-on-ev-charger-standards","https://t.me/PHLNews/160085"
"2023-01-19 08:46:19","PHLNews","shell","DOE, Shell ink EV charging deal  https://mb.com.ph/2023/01/19/doe-shell-ink-ev-charging-deal/?utm_source=rss&utm_medium=rss&utm_campaign=doe-shell-ink-ev-charging-deal","https://t.me/PHLNews/159771"
"2023-01-17 15:06:40","PHLNews","shell","Pilipinas Shell, SUN Mobility to bring advanced battery swapping technology for electric mobility to the Philippines  https://mb.com.ph/2023/01/17/pilipinas-shell-sun-mobility-to-bring-advanced-battery-swapping-technology-for-electric-mobility-to-the-philippines/?utm_source=rss&utm_medium=rss&utm_campaign=pilipinas-shell-sun-mobility-to-bring-advanced-battery-swapping-technology-for-electric-mobility-to-the-philippines","https://t.me/PHLNews/159555"
"2023-01-12 13:21:36","PHLNews","shell","Last Ukraine doctors offer lifeline in shell-ridden Bakhmut  https://mb.com.ph/2023/01/12/last-ukraine-doctors-offer-lifeline-in-shell-ridden-bakhmut/?utm_source=rss&utm_medium=rss&utm_campaign=last-ukraine-doctors-offer-lifeline-in-shell-ridden-bakhmut","https://t.me/PHLNews/159023"
"2022-12-26 01:32:49","PHLNews","shell","Putin says West wants to ‘tear apart’ Russia  https://mb.com.ph/2022/12/26/putin-says-west-wants-to-tear-apart-russia/?utm_source=rss&utm_medium=rss&utm_campaign=putin-says-west-wants-to-tear-apart-russia","https://t.me/PHLNews/157266"
"2022-12-02 01:37:13","PHLNews","shell","Pilipinas Shell CEO shares employee care and sustainability strategies at PH Digicon 2022  https://mb.com.ph/2022/12/02/pilipinas-shell-ceo-shares-employee-care-and-sustainability-strategies-at-ph-digicon-2022/?utm_source=rss&utm_medium=rss&utm_campaign=pilipinas-shell-ceo-shares-employee-care-and-sustainability-strategies-at-ph-digicon-2022","https://t.me/PHLNews/154833"
"2022-11-22 06:01:00","PHLNews","shell","DOST-funded clean tech startup bags top award in Shell liveWIRE global  https://mb.com.ph/2022/11/22/dost-funded-clean-tech-startup-bags-top-award-in-shell-livewire-global/?utm_source=rss&utm_medium=rss&utm_campaign=dost-funded-clean-tech-startup-bags-top-award-in-shell-livewire-global","https://t.me/PHLNews/153736"
"2022-11-14 09:16:51","PHLNews","shell","Pilipinas Shell income rises to P4.4-B in Q3  https://mb.com.ph/2022/11/14/pilipinas-shell-income-rises-to-p4-4-b-in-q3/?utm_source=rss&utm_medium=rss&utm_campaign=pilipinas-shell-income-rises-to-p4-4-b-in-q3","https://t.me/PHLNews/152830"
"2022-11-02 03:30:13","PHLNews","shell","Razon firm absorbs 300 employees from SPEX  https://mb.com.ph/2022/11/02/razon-firm-absorbs-300-employees-from-spex/?utm_source=rss&utm_medium=rss&utm_campaign=razon-firm-absorbs-300-employees-from-spex","https://t.me/PHLNews/151443"
"2022-11-01 00:54:08","PHLNews","shell","Shell formally exits Malampaya gas project  https://mb.com.ph/2022/11/01/shell-formally-exits-malampaya-gas-project/?utm_source=rss&utm_medium=rss&utm_campaign=shell-formally-exits-malampaya-gas-project","https://t.me/PHLNews/151349"
"2022-10-28 08:00:54","PHLNews","shell","Capadocia dumps Milliam, nears eighth PCA Open title  https://mb.com.ph/2022/10/28/capadocia-dumps-milliam-nears-eighth-pca-open-title/?utm_source=rss&utm_medium=rss&utm_campaign=capadocia-dumps-milliam-nears-eighth-pca-open-title","https://t.me/PHLNews/150959"
"2022-10-24 07:48:06","PHLNews","shell","7-time champ Capadocia dumps Mercado in PCA Open  https://mb.com.ph/2022/10/24/7-time-champ-capadocia-dumps-mercado-in-pca-open/?utm_source=rss&utm_medium=rss&utm_campaign=7-time-champ-capadocia-dumps-mercado-in-pca-open","https://t.me/PHLNews/150443"
"2022-10-22 08:29:43","PHLNews","shell","Pague turns back Tugade in PCA Open  https://mb.com.ph/2022/10/22/pague-turns-back-tugade-in-pca-open/?utm_source=rss&utm_medium=rss&utm_campaign=pague-turns-back-tugade-in-pca-open","https://t.me/PHLNews/150265"
"2022-10-21 06:58:55","PHLNews","shell","PCA Open unwraps Saturday  https://mb.com.ph/2022/10/21/pca-open-unwraps-saturday/?utm_source=rss&utm_medium=rss&utm_campaign=pca-open-unwraps-saturday","https://t.me/PHLNews/150180"
"2022-10-08 10:26:37","PHLNews","shell","DLSU, PUP make it to Shell Eco-marathon’s Asian leg  https://mb.com.ph/2022/10/08/dlsu-pup-make-it-to-shell-eco-marathons-asian-leg/?utm_source=rss&utm_medium=rss&utm_campaign=dlsu-pup-make-it-to-shell-eco-marathons-asian-leg","https://t.me/PHLNews/148739"
"2022-10-05 14:07:28","PHLNews","shell","Pinoys shoulder 34%-44.7% of hospital expenses, says PhilHealth  https://www.gmanetwork.com/news/topstories/nation/847100/pinoys-shoulder-34-44-7-of-hospital-expenses-says-philhealth/story/","https://t.me/PHLNews/148432"
"2022-09-22 03:36:04","PHLNews","shell","2 elderly siblings electrocuted in Samar  https://mb.com.ph/2022/09/22/2-elderly-siblings-electrocuted-in-samar/?utm_source=rss&utm_medium=rss&utm_campaign=2-elderly-siblings-electrocuted-in-samar","https://t.me/PHLNews/146823"
"2022-09-09 22:10:31","PHLNews","shell","Shell LiveWIRE mentors to SMEs: Build partnerships to strengthen your brand  https://mb.com.ph/2022/09/10/shell-livewire-mentors-to-smes-build-partnerships-to-strengthen-your-brand/?utm_source=rss&utm_medium=rss&utm_campaign=shell-livewire-mentors-to-smes-build-partnerships-to-strengthen-your-brand","https://t.me/PHLNews/145527"
"2022-09-06 04:55:16","PHLNews","shell","Shelling forces Ukraine nuclear plant off grid as Zelensky warns of ‘disaster’  https://mb.com.ph/2022/09/06/shelling-forces-ukraine-nuclear-plant-off-grid-as-zelensky-warns-of-disaster/?utm_source=rss&utm_medium=rss&utm_campaign=shelling-forces-ukraine-nuclear-plant-off-grid-as-zelensky-warns-of-disaster","https://t.me/PHLNews/145069"
"2022-08-10 02:22:36","PHLNews","shell","PSFI celebrates 40th anniversary with lives transformed by Access to Energy program￼  https://mb.com.ph/2022/08/10/psfi-celebrates-40th-anniversary-with-lives-transformed-by-access-to-energy-program%EF%BF%BC/?utm_source=rss&utm_medium=rss&utm_campaign=psfi-celebrates-40th-anniversary-with-lives-transformed-by-access-to-energy-program%25ef%25bf%25bc","https://t.me/PHLNews/142069"
"2022-08-09 08:20:54","PHLNews","shell","Lotilla directs PNOC-EC to address ‘infirmities’ in Malampaya stake sale  https://mb.com.ph/2022/08/09/lotilla-directs-pnoc-ec-to-address-infirmities-in-malampaya-stake-sale/?utm_source=rss&utm_medium=rss&utm_campaign=lotilla-directs-pnoc-ec-to-address-infirmities-in-malampaya-stake-sale","https://t.me/PHLNews/141982"
"2022-07-18 14:58:08","PHLNews","shell","Choreographer who lost job in pandemic turns to decorative coconut shell pots-making  https://mb.com.ph/2022/07/18/choreographer-who-lost-job-in-pandemic-turns-to-decorative-coconut-shell-pots-making/?utm_source=rss&utm_medium=rss&utm_campaign=choreographer-who-lost-job-in-pandemic-turns-to-decorative-coconut-shell-pots-making","https://t.me/PHLNews/139616"
"2022-07-08 10:28:54","PHLNews","shell","Shell expands mobility offers to include EV charging stations, carbon offset program  https://mb.com.ph/2022/07/08/shell-expands-mobility-offers-to-include-ev-charging-stations-carbon-offset-program/?utm_source=rss&utm_medium=rss&utm_campaign=shell-expands-mobility-offers-to-include-ev-charging-stations-carbon-offset-program","https://t.me/PHLNews/138592"
"2022-07-07 02:34:11","PHLNews","shell","GCash launches special vouchers in the GlobeOne app  https://mb.com.ph/2022/07/07/gcash-launches-special-vouchers-in-the-globeone-app/?utm_source=rss&utm_medium=rss&utm_campaign=gcash-launches-special-vouchers-in-the-globeone-app","https://t.me/PHLNews/138385"
"2022-06-28 02:01:01","PHLNews","shell","Shell, PAL welcome you back to travel & vacations  https://mb.com.ph/2022/06/28/shell-pal-welcome-you-back-to-travel-vacations/?utm_source=rss&utm_medium=rss&utm_campaign=shell-pal-welcome-you-back-to-travel-vacations","https://t.me/PHLNews/137439"
"2022-06-19 13:56:40","PHLNews","shell","Bongbong's fondness for Sara shines through: 'She'll do a great job'  https://mb.com.ph/2022/06/19/shell-do-a-great-job-affectionate-bongbong-says-of-sara/?utm_source=rss&utm_medium=rss&utm_campaign=shell-do-a-great-job-affectionate-bongbong-says-of-sara","https://t.me/PHLNews/136596"
"2022-05-21 07:47:30","PHLNews","shell","Arcilla smothers Lazaro, captures Fr. Suarez crown  https://mb.com.ph/2022/05/21/arcilla-smothers-lazaro-captures-fr-suarez-crown/?utm_source=rss&utm_medium=rss&utm_campaign=arcilla-smothers-lazaro-captures-fr-suarez-crown","https://t.me/PHLNews/133950"
"2022-05-12 07:41:48","PHLNews","shell","Pilipinas Shell empowers Filipinos to sustain community-led initiatives  https://mb.com.ph/2022/05/12/pilipinas-shell-empowers-filipinos-to-sustain-community-led-initiatives/?utm_source=rss&utm_medium=rss&utm_campaign=pilipinas-shell-empowers-filipinos-to-sustain-community-led-initiatives","https://t.me/PHLNews/133014"
"2022-05-06 08:35:45","PHLNews","shell","Pilipinas Shell sets realignment of capex rollout  https://mb.com.ph/2022/05/06/pilipinas-shell-sets-realignment-of-capex-rollout/?utm_source=rss&utm_medium=rss&utm_campaign=pilipinas-shell-sets-realignment-of-capex-rollout","https://t.me/PHLNews/132323"
"2022-04-28 09:46:58","PHLNews","shell","KID NO MORE! Lianne Valentin on coming out of her shell  https://mb.com.ph/2022/04/28/kid-no-more-lianne-valentin-on-coming-out-of-her-shell/?utm_source=rss&utm_medium=rss&utm_campaign=kid-no-more-lianne-valentin-on-coming-out-of-her-shell","https://t.me/PHLNews/131445"
"2025-12-12 18:36:26","PHLNews","typhoon","DepEd's disaster preparedness to get boost in 2026 budget  https://www.gmanetwork.com/news/topstories/nation/969403/deped-s-disaster-preparedness-to-get-boost-in-2026-budget/story/","https://t.me/PHLNews/199640"
"2025-12-11 04:01:24","PHLNews","typhoon","Shell sued in UK over 2021 Philippine Typhoon Odette -- NGOs  https://www.gmanetwork.com/news/topstories/nation/969181/shell-sued-in-uk-over-2021-philippine-typhoon-odette-ngos/story/","https://t.me/PHLNews/199582"
"2025-11-27 12:42:37","PHLNews","typhoon","'Verbena' leaves PAR  https://www.philstar.com/weather/2025/11/27/2490280/verbena-leaves-par","https://t.me/PHLNews/199122"
"2025-11-22 08:59:50","PHLNews","typhoon","DOH: Dengue cases went down to 14K cases in October before typhoons  https://www.gmanetwork.com/news/topstories/nation/967023/doh-dengue-cases-went-down-to-14k-cases-in-october-before-typhoons/story/","https://t.me/PHLNews/198943"
"2025-11-20 06:21:32","PHLNews","typhoon","NIA chief Guillen dared to resign over 'defects' on repaired irrigation projects  https://www.gmanetwork.com/news/topstories/nation/966810/nia-chief-guillen-dared-to-resign-over-defects-on-repaired-irrigation-projects/story/","https://t.me/PHLNews/198872"
"2025-11-17 22:50:46","PHLNews","typhoon","DILG readies raps vs local execs who defied travel ban   https://newsinfo.inquirer.net/2142023/dilg-readies-raps-vs-local-execs-who-defied-travel-ban","https://t.me/PHLNews/198776"
"2025-11-17 11:58:53","PHLNews","typhoon","ICI inspects Cebu flood control projects  https://www.gmanetwork.com/news/topstories/nation/966423/ici-inspects-cebu-flood-control-projects/story/","https://t.me/PHLNews/198758"
"2025-11-17 08:51:01","PHLNews","typhoon","269 dead, 523 injured due to Typhoon Tino -- OCD  https://www.gmanetwork.com/news/topstories/nation/966407/269-dead-523-injured-due-to-typhoon-tino-ocd/story/","https://t.me/PHLNews/198748"
"2025-11-16 16:52:20","PHLNews","typhoon","DSWD hails man with disability who died while saving others during Tino wrath  https://www.gmanetwork.com/news/topstories/nation/966343/dswd-hails-man-with-disability-who-died-while-saving-others-during-tino-wrath/story/","https://t.me/PHLNews/198730"
"2025-11-15 18:48:44","PHLNews","typhoon","Leviste gives ‘P6 billion’ to typhoon victims; US gives $1.5 million  https://www.philstar.com/headlines/2025/11/16/2487592/leviste-gives-p6-billion-typhoon-victims-us-gives-15-million","https://t.me/PHLNews/198701"
"2025-11-15 07:30:15","PHLNews","typhoon","US adds $1.5M in PH disaster assistance after Uwan's wrath  https://www.gmanetwork.com/news/topstories/nation/966230/us-adds-1-5m-in-ph-disaster-assistance-after-uwan-s-wrath/story/","https://t.me/PHLNews/198694"
"2025-11-15 03:22:11","PHLNews","typhoon","EU releases over P85 million for typhoon relief as Philippines reels from devastation  https://www.philstar.com/headlines/2025/11/15/2487418/eu-releases-over-p85-million-typhoon-relief-philippines-reels-devastation","https://t.me/PHLNews/198689"
"2025-11-14 07:17:57","PHLNews","typhoon","US deploys troops, assets to Philippines after consecutive typhoons  https://www.philstar.com/headlines/2025/11/14/2487209/us-deploys-troops-assets-philippines-after-consecutive-typhoons","https://t.me/PHLNews/198648"
"2025-11-13 18:18:50","PHLNews","typhoon","House authorized London trip during Tino– Frasco  https://www.philstar.com/headlines/2025/11/14/2487105/house-authorized-london-trip-during-tino-frasco","https://t.me/PHLNews/198630"
"2025-11-13 13:25:16","PHLNews","typhoon","Leviste""s foundation donates P6 billion share sales to poor students, typhoon victims  https://www.gmanetwork.com/news/topstories/nation/966033/leviste-s-foundation-donates-p6-billion-share-sales-to-poor-students-typhoon-victims/story/","https://t.me/PHLNews/198620"
"2025-11-13 13:22:16","PHLNews","typhoon","US military sends disaster relief support to PH after recent typhoons  https://www.gmanetwork.com/news/topstories/nation/966030/us-military-sends-disaster-relief-support-to-ph-after-recent-typhoons/story/","https://t.me/PHLNews/198617"
"2025-11-13 00:19:42","PHLNews","typhoon","VP Sara extends sympathies to flood victims: 'They feel as if the government failed them""   https://www.gmanetwork.com/news/topstories/nation/965903/vp-sara-extends-sympathies-to-flood-victims-they-feel-as-if-the-government-failed-them/story/","https://t.me/PHLNews/198593"
"2025-11-13 00:19:40","PHLNews","typhoon","DSWD prioritizing emergency cash aid for Uwan victims with damaged homes  https://www.gmanetwork.com/news/topstories/nation/965906/dswd-prioritizing-emergency-cash-aid-for-uwan-victims-with-damaged-homes/story/","https://t.me/PHLNews/198592"
"2025-11-12 23:38:13","PHLNews","typhoon","‘Forced work’? Millions depend on BPOs, rain or shine, says group    https://newsinfo.inquirer.net/2139127/forced-work-millions-depend-on-bpos-rain-or-shine-says-group","https://t.me/PHLNews/198587"
"2025-11-12 19:39:18","PHLNews","typhoon","DepEd releases P661.1 million for school repairs after Uwan  https://www.philstar.com/headlines/2025/11/13/2486859/deped-releases-p6611-million-school-repairs-after-uwan","https://t.me/PHLNews/198582"
"2025-11-12 14:32:50","PHLNews","typhoon","House urges swift gov't aid to typhoon-hit communities  https://www.gmanetwork.com/news/topstories/nation/965869/house-urges-swift-government-aid-delivery-to-typhoon-hit-communities/story/","https://t.me/PHLNews/198574"
"2025-11-12 14:29:44","PHLNews","typhoon","Uwan damages almost 3K schools, displaces over 900K learners  https://www.gmanetwork.com/news/topstories/nation/965853/uwan-damages-almost-3k-schools-displaces-over-900k-learners/story/","https://t.me/PHLNews/198570"
"2025-11-12 05:18:26","PHLNews","typhoon","DILG: 24 local officials under probe over foreign trips amid Uwan  https://www.gmanetwork.com/news/topstories/nation/965787/dilg-24-local-officials-under-probe-over-foreign-trips-amid-uwan/story/","https://t.me/PHLNews/198564"
"2025-11-12 00:36:55","PHLNews","typhoon","UN lauds Philippines preparedness as it warns of worse typhoon risks  https://www.philstar.com/climate-and-environment/2025/11/12/2486556/un-lauds-philippines-preparedness-it-warns-worse-typhoon-risks","https://t.me/PHLNews/198558"
"2025-11-11 22:56:37","PHLNews","typhoon","Cebu officials who left PH amid Typhoon Tino face complaint  https://newsinfo.inquirer.net/2138369/cebu-officials-who-left-ph-amid-tino-face-complaint","https://t.me/PHLNews/198557"
"2025-11-11 19:33:15","PHLNews","typhoon","DSWD chief: Relief, recovery for Uwan-hit Catanduanes to continue  https://www.gmanetwork.com/news/topstories/nation/965764/dswd-chief-relief-recovery-for-uwan-hit-catanduanes-to-continue/story/","https://t.me/PHLNews/198553"
"2025-11-11 16:51:33","PHLNews","typhoon","King Charles sends sympathy to Pinoys after calamities  https://www.philstar.com/headlines/2025/11/12/2486594/king-charles-sends-sympathy-pinoys-after-calamities","https://t.me/PHLNews/198550"
"2025-11-11 16:49:12","PHLNews","typhoon","Marcos: Don’t just chill during calamities  https://www.philstar.com/headlines/2025/11/12/2486590/marcos-dont-just-chill-during-calamities","https://t.me/PHLNews/198548"
"2025-11-11 16:01:07","PHLNews","typhoon","China to give $2.4-M relief aid to PH after deadly typhoons  https://www.gmanetwork.com/news/topstories/nation/965742/china-to-give-2-4-m-relief-aid-to-ph-after-deadly-typhoons/story/","https://t.me/PHLNews/198547"
"2025-11-11 16:00:06","PHLNews","typhoon","Uwan death toll now at 25 -- OCD  https://www.gmanetwork.com/news/topstories/nation/965737/uwan-death-toll-now-at-25-ocd/story/","https://t.me/PHLNews/198546"
"2025-11-11 10:26:45","PHLNews","typhoon","King Charles expresses sympathy to typhoon, earthquake victims in Philippines  https://www.philstar.com/headlines/2025/11/11/2486445/king-charles-expresses-sympathy-typhoon-earthquake-victims-philippines","https://t.me/PHLNews/198537"
"2025-11-11 07:00:49","PHLNews","typhoon","Marcos satisfied with PH preemptive measures for Uwan  https://www.gmanetwork.com/news/topstories/nation/965670/marcos-satisfied-with-ph-preemptive-measures-for-uwan/story/","https://t.me/PHLNews/198532"
"2025-11-11 04:40:02","PHLNews","typhoon","Tino death toll rises to 232, missing now 112 --OCD  https://www.gmanetwork.com/news/topstories/nation/965635/tino-death-toll-rises-to-232-missing-now-112-ocd/story/","https://t.me/PHLNews/198525"
"2025-11-11 04:39:02","PHLNews","typhoon","Uwan death toll now 6 --NDRRMC  https://www.gmanetwork.com/news/topstories/nation/965631/uwan-death-toll-now-6-ndrrmc/story/","https://t.me/PHLNews/198524"
"2025-11-11 04:38:02","PHLNews","typhoon","LIVE UPDATES: Typhoon Uwan (Fung-Wong), Nov. 11, 2025  https://www.gmanetwork.com/news/topstories/nation/965630/live-updates-typhoon-uwan-fung-wong-nov-11-2025/story/","https://t.me/PHLNews/198523"
"2025-11-11 04:37:01","PHLNews","typhoon","Labor group calls for post-flood checks of affected workplaces  https://www.gmanetwork.com/news/topstories/nation/965626/labor-group-calls-for-post-flood-checks-of-affected-workplaces/story/","https://t.me/PHLNews/198522"
"2025-11-11 04:34:02","PHLNews","typhoon","DSWD: P6.4M in initial relief aid given to Uwan victims  https://www.gmanetwork.com/news/topstories/nation/965616/dswd-p6-4m-in-initial-relief-aid-given-to-uwan-victims/story/","https://t.me/PHLNews/198519"
"2025-11-11 04:32:02","PHLNews","typhoon","DILG to check local officials' absence amid Super Typhoon Uwan onslaught  https://www.gmanetwork.com/news/topstories/nation/965599/dilg-officials-uwan-emergency/story/","https://t.me/PHLNews/198517"
"2025-11-10 22:39:50","PHLNews","typhoon","Thousands stranded but no travel casualties  https://newsinfo.inquirer.net/2137756/thousands-stranded-but-no-travel-casualties","https://t.me/PHLNews/198512"
"2025-11-10 18:03:46","PHLNews","typhoon","Uwan cripples PNR bridge in Albay  https://www.philstar.com/headlines/2025/11/11/2486289/uwan-cripples-pnr-bridge-albay","https://t.me/PHLNews/198509"
"2025-11-10 12:02:32","PHLNews","typhoon","Floods, storm surge warnings still up as 'Uwan' starts exit  https://www.philstar.com/headlines/2025/11/10/2486203/floods-storm-surge-warnings-still-uwan-starts-exit","https://t.me/PHLNews/198506"
"2025-11-10 08:24:32","PHLNews","typhoon","LIST: Resumed trips at PITX amid Typhoon Uwan  https://www.gmanetwork.com/news/topstories/nation/965553/list-resumed-trips-at-pitx-amid-typhoon-uwan/story/","https://t.me/PHLNews/198503"
"2025-11-10 08:23:32","PHLNews","typhoon","Canadian Embassy sympathizes with Uwan victims  https://www.gmanetwork.com/news/topstories/nation/965539/canadian-embassy-sympathizes-with-uwan-victims/story/","https://t.me/PHLNews/198502"
"2025-11-10 08:22:01","PHLNews","typhoon","PCG: 4 ships ran aground after Uwan's onslaught  https://www.philstar.com/headlines/2025/11/10/2486201/pcg-4-ships-ran-aground-after-uwans-onslaught","https://t.me/PHLNews/198501"
